{
 "username": "SJ",
 "claimed": true,
 "claimedBy": "SJTAS813",
 "claimedAt": "2026-10-09",
 "claimedAtTime": "2026-10-09T03:57:10Z",
 "claimMethod": "committee",
 "attestedBy": "eien86",
 "attestation": "Claim approved by the Steering Committee. i also asked on discord to get my old name back from tasvideo but now i want it in toolassited.run\r\n\r\nthis is my youtube channel which also shows SJ   but if you look at the bottom it also says @SJTAS813 \r\n\r\nhttps://www.youtube.com/@SJTAS813\r\n\r\nit has my mortal kombat tases, crazy taxi's, rocket power beach bandits, cat woman you name it  my name also appear on tasvideos which only shows SJ"
}
