{
 "username": "DrD2k9",
 "claimed": true,
 "claimedBy": "DrD2k9-TAR",
 "claimedAt": "2026-09-02",
 "claimedAtTime": "2026-09-02T05:03:47Z",
 "claimMethod": "committee",
 "attestedBy": "eien86",
 "attestation": "Claim approved by the Steering Committee. screenshot of me logged into TASVideos:  https://i.ibb.co/zhs22DCS/img1.png"
}
